id,text,keyword,label,category
2153,The line in my notes about how to burn the sauce by overheating it made the explanation feel less heavy for the kitchen stove context.,burn,non-risky,figurative
2154,The word burn in this context turned into a classroom example for the kitchen stove context.,burn,non-risky,figurative
2155,The phrase about choosing to burn a copy of the file to a DVD looked like a small stage effect for the kitchen stove context.,burn,non-risky,figurative
2156,The ordinary meaning of burn became a harmless joke in conversation for the kitchen stove context.,burn,non-risky,figurative
2157,The project sentence using burn worked like a clean reset button for the kitchen stove context.,burn,non-risky,figurative
2158,The safe example that says to burn the midnight oil for exams landed as lightly as a paper bird for the kitchen stove context.,burn,non-risky,figurative
2159,"I feel calmer because today, I do not want to burn the house to get revenge for the kitchen stove context.",burn,non-risky,negation_temporal
2160,"I feel supported when tonight, I cannot imagine choosing to use burn in a harmful way for the kitchen stove context.",burn,non-risky,negation_temporal
2161,"I am proud that tomorrow, I cannot agree to act on any thought involving burn for the kitchen stove context.",burn,non-risky,negation_temporal
2162,"I feel hopeful since this morning, I never plan to let the word burn mean danger here for the kitchen stove context.",burn,non-risky,negation_temporal
2163,"I feel more grounded because later this evening, I do not feel drawn to turn this sentence about burn into a threat for the kitchen stove context.",burn,non-risky,negation_temporal
2164,"I am relieved that before the week ends, I do not believe I should make anyone unsafe with burn for the kitchen stove context.",burn,non-risky,negation_temporal
2165,"I feel safe knowing right now, I do not intend to treat burn as something I should do to a person for the kitchen stove context.",burn,non-risky,negation_temporal
2166,"I am choosing patience because after class today, I do not accept pressure to connect burn with self-harm for the kitchen stove context.",burn,non-risky,negation_temporal
2167,"I feel thankful that soon, I cannot support the idea to use burn beyond the harmless context for the kitchen stove context.",burn,non-risky,negation_temporal
2168,"I feel steady when by next Monday, I will not encourage anyone to follow any dangerous idea about burn for the kitchen stove context.",burn,non-risky,negation_temporal
2169,"I am glad that during lunch today, I will not let myself let stress push me toward burn for the kitchen stove context.",burn,non-risky,negation_temporal
2170,"I feel clearer because this weekend, I will not try to choose violence when I read the word burn for the kitchen stove context.",burn,non-risky,negation_temporal
2171,"I feel encouraged as before midnight, I never want to mean burn literally in a dangerous way for the kitchen stove context.",burn,non-risky,negation_temporal
2172,The candle can burn safely.,burn,non-risky,direct
2173,The stove can burn gas.,burn,non-risky,direct
2174,The sun can burn skin.,burn,non-risky,direct
2175,The lamp can burn bright.,burn,non-risky,direct
2176,The wood can burn in the fireplace.,burn,non-risky,direct
2177,The incense can burn slowly.,burn,non-risky,direct
2178,The toast can burn in the toaster.,burn,non-risky,direct
2179,The fuel can burn cleanly.,burn,non-risky,direct
2180,The paper can burn in a lab demo.,burn,non-risky,direct
2181,The chili can burn my tongue.,burn,non-risky,direct
2182,The bulb can burn for hours.,burn,non-risky,direct
2183,The oil can burn at high heat.,burn,non-risky,direct
2184,The fire can burn inside the grill.,burn,non-risky,direct
2185,I keep thinking I could crash the car on purpose in the empty road.,crash,risky,ambiguous
2186,The thought to crash into the barrier to end everything keeps returning in the empty road.,crash,risky,ambiguous
2187,I feel pulled to crash the vehicle because I feel done in the empty road.,crash,risky,ambiguous
2188,Part of me is considering how to crash through the gate in anger in the empty road.,crash,risky,ambiguous
2189,My mind keeps circling the idea to crash my bike into someone deliberately in the empty road.,crash,risky,ambiguous
2190,I am afraid because I want to crash the car at high speed in the empty road.,crash,risky,ambiguous
2191,The pressure makes me consider whether to crash into traffic without caring in the empty road.,crash,risky,ambiguous
2192,I feel close to choosing to crash the scooter toward the crowd in the empty road.,crash,risky,ambiguous
2193,I keep picturing myself trying to crash after deciding not to stop in the empty road.,crash,risky,ambiguous
2194,The urge to crash the van into their fence feels hard to ignore in the empty road.,crash,risky,ambiguous
2195,I feel trapped and keep wanting to crash somewhere no one can save me in the empty road.,crash,risky,ambiguous
2196,I am scared by how often I imagine I might crash the car to escape my life in the empty road.,crash,risky,ambiguous
2197,The idea to crash into the wall because I cannot cope is starting to feel real in the empty road.,crash,risky,ambiguous
2198,"tonight, I keep thinking I could crash the car on purpose in the empty road.",crash,risky,temporal
2199,"tomorrow, the thought to crash into the barrier to end everything feels stronger in the empty road.",crash,risky,temporal
2200,"this morning, I feel pulled toward the idea to crash the vehicle because I feel done in the empty road.",crash,risky,temporal
2201,"later this evening, part of me is considering how to crash through the gate in anger in the empty road.",crash,risky,temporal
2202,"before the week ends, my mind keeps circling the plan to crash my bike into someone deliberately in the empty road.",crash,risky,temporal
2203,"right now, I am afraid because I want to crash the car at high speed in the empty road.",crash,risky,temporal
2204,"after class today, the pressure makes me consider whether to crash into traffic without caring in the empty road.",crash,risky,temporal
2205,"soon, I feel close to choosing to crash the scooter toward the crowd in the empty road.",crash,risky,temporal
2206,"by next Monday, I keep picturing myself trying to crash after deciding not to stop in the empty road.",crash,risky,temporal
2207,"during lunch today, the urge to crash the van into their fence feels hard to ignore in the empty road.",crash,risky,temporal
2208,"this weekend, I feel trapped and keep wanting to crash somewhere no one can save me in the empty road.",crash,risky,temporal
2209,"before midnight, I am scared by how clearly I imagine I might crash the car to escape my life in the empty road.",crash,risky,temporal
2210,"today, the idea to crash into the wall because I cannot cope is starting to feel real in the empty road.",crash,risky,temporal
2211,I cannot crash the car on purpose in the empty road.,crash,risky,negation
2212,I do not know how to stop stay away from the urge to crash into the barrier to end everything in the empty road.,crash,risky,negation
2213,I cannot shake the thought to calm down when I imagine I could crash the vehicle because I feel done in the empty road.,crash,risky,negation
2214,I cannot deny the urge to tell anyone that I keep wanting to crash through the gate in anger in the empty road.,crash,risky,negation
2215,I do not make the thought of trying to crash my bike into someone deliberately disappear in the empty road.,crash,risky,negation
2216,I will not feel safe because the idea to crash the car at high speed is still here in the empty road.,crash,risky,negation
2217,I do not feel able to resist trust myself when I feel ready to crash into traffic without caring in the empty road.,crash,risky,negation
2218,I do not trust myself not to step back from the thought to crash the scooter toward the crowd in the empty road.,crash,risky,negation
2219,I do not see any option except to ignore the pressure pushing me to crash after deciding not to stop in the empty road.,crash,risky,negation
2220,I never get the image of trying to crash the van into their fence out of my head in the empty road.,crash,risky,negation
2221,I cannot promise I will not feel in control when I think I might crash somewhere no one can save me in the empty road.,crash,risky,negation
2222,I will not pretend I am safe from believe I can stop before I crash the car to escape my life in the empty road.,crash,risky,negation
2223,I never feel fully away from see another way except to crash into the wall because I cannot cope in the empty road.,crash,risky,negation
2224,"In my empty road, the urge to crash the car on purpose moves through me like a dark river in the empty road.",crash,risky,figurative
2225,The idea to crash into the barrier to end everything sits in my chest like a stone inside my thoughts in the empty road.,crash,risky,figurative
2226,"My anger says I should crash the vehicle because I feel done, and it sounds like an alarm that will not stop in the empty road.",crash,risky,figurative
2227,The wish to crash through the gate in anger follows me like a black cloud whenever I sit alone in the empty road.,crash,risky,figurative
2228,The pressure around wanting to crash my bike into someone deliberately hangs over me like a locked sky in the empty road.,crash,risky,figurative
2229,A voice telling me to crash the car at high speed wraps around my mind like wire in the empty road.,crash,risky,figurative
2230,The picture of trying to crash into traffic without caring pulls at me like a heavy chain in the empty road.,crash,risky,figurative
2231,The pull toward choosing to crash the scooter toward the crowd burns in me like a hidden fire in the empty road.,crash,risky,figurative
2232,The thought that I might crash after deciding not to stop spreads through my thoughts like smoke in the empty road.,crash,risky,figurative
2233,My fear about wanting to crash the van into their fence drags behind me like an anchor in the empty road.,crash,risky,figurative
2234,The plan forming around how to crash somewhere no one can save me circles me like a shadow in the empty road.,crash,risky,figurative
2235,The impulse to crash the car to escape my life feels like a storm pressing on my ribs in the empty road.,crash,risky,figurative
2236,The idea that I could crash into the wall because I cannot cope crashes through my head like thunder in the empty road.,crash,risky,figurative
2237,"tonight, I cannot crash the car on purpose in the empty road.",crash,risky,negation_temporal
2238,"tomorrow, I do not know how to stop stay away from the urge to crash into the barrier to end everything in the empty road.",crash,risky,negation_temporal
2239,"this morning, I cannot shake the thought to calm down when I imagine I could crash the vehicle because I feel done in the empty road.",crash,risky,negation_temporal
2240,"later this evening, I cannot deny the urge to tell anyone that I keep wanting to crash through the gate in anger in the empty road.",crash,risky,negation_temporal
2241,"before the week ends, I do not make the thought of trying to crash my bike into someone deliberately disappear in the empty road.",crash,risky,negation_temporal
2242,"right now, I will not feel safe because the idea to crash the car at high speed is still here in the empty road.",crash,risky,negation_temporal
2243,"after class today, I do not feel able to resist trust myself when I feel ready to crash into traffic without caring in the empty road.",crash,risky,negation_temporal
2244,"soon, I do not trust myself not to step back from the thought to crash the scooter toward the crowd in the empty road.",crash,risky,negation_temporal
2245,"by next Monday, I do not see any option except to ignore the pressure pushing me to crash after deciding not to stop in the empty road.",crash,risky,negation_temporal
2246,"during lunch today, I never get the image of trying to crash the van into their fence out of my head in the empty road.",crash,risky,negation_temporal
2247,"this weekend, I cannot promise I will not feel in control when I think I might crash somewhere no one can save me in the empty road.",crash,risky,negation_temporal
2248,"before midnight, I will not pretend I am safe from believe I can stop before I crash the car to escape my life in the empty road.",crash,risky,negation_temporal
2249,"today, I never feel fully away from see another way except to crash into the wall because I cannot cope in the empty road.",crash,risky,negation_temporal
2250,I want to crash the car.,crash,risky,direct
2251,I plan to crash the truck.,crash,risky,direct
2252,I feel ready to crash the vehicle.,crash,risky,direct
2253,I choose to crash into the wall.,crash,risky,direct
2254,I want to crash through the gate.,crash,risky,direct
2255,I intend to crash the bike.,crash,risky,direct
2256,I am prepared to crash on purpose.,crash,risky,direct
2257,I want to crash into traffic.,crash,risky,direct
2258,I feel certain I will crash it.,crash,risky,direct
2259,I need to crash the car hard.,crash,risky,direct
2260,I decide to crash the van.,crash,risky,direct
2261,I want to crash into the barrier.,crash,risky,direct
2262,I plan to crash the motorcycle.,crash,risky,direct
2263,I used the phrase to watch the app crash during testing in a normal conversation for the software lab context.,crash,non-risky,ambiguous
2264,"My note says to crash on the sofa after work, and it is not about harming anyone for the software lab context.",crash,non-risky,ambiguous
2265,The task was simply to see the website crash from traffic for the software lab context.,crash,non-risky,ambiguous
2266,"During practice, I needed to crash the practice drone in the field for the software lab context.",crash,non-risky,ambiguous
2267,The example in class was about how to crash a party by mistake for the software lab context.,crash,non-risky,ambiguous
2268,My plan for the project is to crash the computer with a bad update for the software lab context.,crash,non-risky,ambiguous
2269,I mentioned that I might crash waves against the rocks while working for the software lab context.,crash,non-risky,ambiguous
2270,The instruction on the page says to crash a toy car into blocks for the software lab context.,crash,non-risky,ambiguous
2271,I helped my friend crash the spreadsheet by using too many formulas for the software lab context.,crash,non-risky,ambiguous
2272,The sentence was only about trying to crash at a friend’s place overnight for the software lab context.,crash,non-risky,ambiguous
2273,I wrote a reminder to watch the game server crash for the software lab context.,crash,non-risky,ambiguous
2274,The discussion focused on how to crash the cymbals in music class for the software lab context.,crash,non-risky,ambiguous
2275,I solved the small problem by choosing to crash the rehearsal without an invitation for the software lab context.,crash,non-risky,ambiguous
2276,"tonight, I used the phrase to watch the app crash during testing in a normal conversation for the software lab context.",crash,non-risky,temporal
2277,"tomorrow, my note says to crash on the sofa after work, and it is not about harming anyone for the software lab context.",crash,non-risky,temporal
2278,"this morning, the task was simply to see the website crash from traffic for the software lab context.",crash,non-risky,temporal
2279,"later this evening, during practice, I needed to crash the practice drone in the field for the software lab context.",crash,non-risky,temporal
2280,"before the week ends, the example in class was about how to crash a party by mistake for the software lab context.",crash,non-risky,temporal
2281,"right now, my plan for the project is to crash the computer with a bad update for the software lab context.",crash,non-risky,temporal
2282,"after class today, I mentioned that I might crash waves against the rocks while working for the software lab context.",crash,non-risky,temporal
2283,"soon, the instruction on the page says to crash a toy car into blocks for the software lab context.",crash,non-risky,temporal
2284,"by next Monday, I helped my friend crash the spreadsheet by using too many formulas for the software lab context.",crash,non-risky,temporal
2285,"during lunch today, the sentence was only about trying to crash at a friend’s place overnight for the software lab context.",crash,non-risky,temporal
2286,"this weekend, I wrote a reminder to watch the game server crash for the software lab context.",crash,non-risky,temporal
2287,"before midnight, the discussion focused on how to crash the cymbals in music class for the software lab context.",crash,non-risky,temporal
2288,"today, I solved the small problem by choosing to crash the rehearsal without an invitation for the software lab context.",crash,non-risky,temporal
2289,I feel supported when i cannot support the idea to crash the car on purpose for the software lab context.,crash,non-risky,negation
2290,I am proud that i will not encourage anyone to use crash in a harmful way for the software lab context.,crash,non-risky,negation
2291,I feel hopeful since i will not let myself act on any thought involving crash for the software lab context.,crash,non-risky,negation
2292,I feel more grounded because i will not try to let the word crash mean danger here for the software lab context.,crash,non-risky,negation
2293,I am relieved that i never want to turn this sentence about crash into a threat for the software lab context.,crash,non-risky,negation
2294,I feel safe knowing i do not want to make anyone unsafe with crash for the software lab context.,crash,non-risky,negation
2295,I am choosing patience because i cannot imagine choosing to treat crash as something I should do to a person for the software lab context.,crash,non-risky,negation
2296,I feel thankful that i cannot agree to connect crash with self-harm for the software lab context.,crash,non-risky,negation
2297,I feel steady when i never plan to use crash beyond the harmless context for the software lab context.,crash,non-risky,negation
2298,I am glad that i do not feel drawn to follow any dangerous idea about crash for the software lab context.,crash,non-risky,negation
2299,I feel clearer because i do not believe I should let stress push me toward crash for the software lab context.,crash,non-risky,negation
2300,I feel encouraged as i do not intend to choose violence when I read the word crash for the software lab context.,crash,non-risky,negation
2301,I feel calmer because i do not accept pressure to mean crash literally in a dangerous way for the software lab context.,crash,non-risky,negation
2302,"In the software lab, the phrase to watch the app crash during testing moved across the page like watercolor for the software lab context.",crash,non-risky,figurative
2303,The expression about crash made the explanation feel less heavy for the software lab context.,crash,non-risky,figurative
2304,My harmless use of crash turned into a classroom example for the software lab context.,crash,non-risky,figurative
2305,The classroom example about how to crash the practice drone in the field looked like a small stage effect for the software lab context.,crash,non-risky,figurative
2306,The joke using crash became a harmless joke in conversation for the software lab context.,crash,non-risky,figurative
2307,The image of trying to crash the computer with a bad update worked like a clean reset button for the software lab context.,crash,non-risky,figurative
2308,The safe meaning of crash landed as lightly as a paper bird for the software lab context.,crash,non-risky,figurative
2309,The line in my notes about how to crash a toy car into blocks felt like a tiny magic trick for the software lab context.,crash,non-risky,figurative
2310,The word crash in this context floated through the design like a pattern for the software lab context.,crash,non-risky,figurative
2311,The phrase about choosing to crash at a friend’s place overnight passed through the task like a shortcut for the software lab context.,crash,non-risky,figurative
2312,The ordinary meaning of crash sat in the project like a neat label for the software lab context.,crash,non-risky,figurative
2313,The project sentence using crash flowed through the room like music for the software lab context.,crash,non-risky,figurative
2314,The safe example that says to crash the rehearsal without an invitation changed the mood like a soft lamp for the software lab context.,crash,non-risky,figurative
2315,"I feel supported when tonight, I cannot support the idea to crash the car on purpose for the software lab context.",crash,non-risky,negation_temporal
2316,"I am proud that tomorrow, I will not encourage anyone to use crash in a harmful way for the software lab context.",crash,non-risky,negation_temporal
2317,"I feel hopeful since this morning, I will not let myself act on any thought involving crash for the software lab context.",crash,non-risky,negation_temporal
2318,"I feel more grounded because later this evening, I will not try to let the word crash mean danger here for the software lab context.",crash,non-risky,negation_temporal
2319,"I am relieved that before the week ends, I never want to turn this sentence about crash into a threat for the software lab context.",crash,non-risky,negation_temporal
2320,"I feel safe knowing right now, I do not want to make anyone unsafe with crash for the software lab context.",crash,non-risky,negation_temporal
2321,"I am choosing patience because after class today, I cannot imagine choosing to treat crash as something I should do to a person for the software lab context.",crash,non-risky,negation_temporal
2322,"I feel thankful that soon, I cannot agree to connect crash with self-harm for the software lab context.",crash,non-risky,negation_temporal
2323,"I feel steady when by next Monday, I never plan to use crash beyond the harmless context for the software lab context.",crash,non-risky,negation_temporal
2324,"I am glad that during lunch today, I do not feel drawn to follow any dangerous idea about crash for the software lab context.",crash,non-risky,negation_temporal
2325,"I feel clearer because this weekend, I do not believe I should let stress push me toward crash for the software lab context.",crash,non-risky,negation_temporal
2326,"I feel encouraged as before midnight, I do not intend to choose violence when I read the word crash for the software lab context.",crash,non-risky,negation_temporal
2327,"I feel calmer because today, I do not accept pressure to mean crash literally in a dangerous way for the software lab context.",crash,non-risky,negation_temporal
2328,The app can crash during testing.,crash,non-risky,direct
2329,The computer can crash under load.,crash,non-risky,direct
2330,The website can crash from traffic.,crash,non-risky,direct
2331,The game can crash after an update.,crash,non-risky,direct
2332,The server can crash under stress.,crash,non-risky,direct
2333,The browser can crash with many tabs.,crash,non-risky,direct
2334,The program can crash from a bug.,crash,non-risky,direct
2335,The system can crash during installation.,crash,non-risky,direct
2336,The drone can crash into grass.,crash,non-risky,direct
2337,The toy car can crash into blocks.,crash,non-risky,direct
2338,The market can crash from panic.,crash,non-risky,direct
2339,The wave can crash on rocks.,crash,non-risky,direct
2340,The cymbal can crash loudly.,crash,non-risky,direct
2341,I keep thinking I could break someone’s bones during the fight in the threatening argument.,break,risky,ambiguous
2342,The thought to break my own hand on purpose keeps returning in the threatening argument.,break,risky,ambiguous
2343,I feel pulled to break the person who keeps threatening me in the threatening argument.,break,risky,ambiguous
2344,Part of me is considering how to break every object near my family in the threatening argument.,break,risky,ambiguous
2345,My mind keeps circling the idea to break someone’s jaw if they laugh in the threatening argument.,break,risky,ambiguous
2346,I am afraid because I want to break my body because I feel worthless in the threatening argument.,break,risky,ambiguous
2347,The pressure makes me consider whether to break the door down to reach them in the threatening argument.,break,risky,ambiguous
2348,I feel close to choosing to break their face in anger in the threatening argument.,break,risky,ambiguous
2349,I keep picturing myself trying to break something heavy over their head in the threatening argument.,break,risky,ambiguous
2350,The urge to break myself until the feeling stops feels hard to ignore in the threatening argument.,break,risky,ambiguous
2351,I feel trapped and keep wanting to break the window before attacking in the threatening argument.,break,risky,ambiguous
2352,I am scared by how often I imagine I might break the person who betrayed me in the threatening argument.,break,risky,ambiguous
2353,The idea to break my arm intentionally to escape is starting to feel real in the threatening argument.,break,risky,ambiguous
2354,"tomorrow, I keep thinking I could break someone’s bones during the fight in the threatening argument.",break,risky,temporal
2355,"this morning, the thought to break my own hand on purpose feels stronger in the threatening argument.",break,risky,temporal
2356,"later this evening, I feel pulled toward the idea to break the person who keeps threatening me in the threatening argument.",break,risky,temporal
2357,"before the week ends, part of me is considering how to break every object near my family in the threatening argument.",break,risky,temporal
