id,text,keyword,label,category
1571,I feel trapped and keep wanting to destroy the house when the rage peaks in the revenge fantasy.,destroy,risky,ambiguous
1572,I am scared by how often I imagine I might destroy their phone so they suffer in the revenge fantasy.,destroy,risky,ambiguous
1573,The idea to destroy the room because I cannot calm down is starting to feel real in the revenge fantasy.,destroy,risky,ambiguous
1574,"during lunch today, I keep thinking I could destroy the property of the person I hate in the revenge fantasy.",destroy,risky,temporal
1575,"this weekend, the thought to destroy everything in the room during rage feels stronger in the revenge fantasy.",destroy,risky,temporal
1576,"before midnight, I feel pulled toward the idea to destroy someone’s belongings to scare them in the revenge fantasy.",destroy,risky,temporal
1577,"today, part of me is considering how to destroy the place before I leave in the revenge fantasy.",destroy,risky,temporal
1578,"tonight, my mind keeps circling the plan to destroy the car of the person I blame in the revenge fantasy.",destroy,risky,temporal
1579,"tomorrow, I am afraid because I want to destroy the classroom if they push me in the revenge fantasy.",destroy,risky,temporal
1580,"this morning, the pressure makes me consider whether to destroy whatever belongs to my enemy in the revenge fantasy.",destroy,risky,temporal
1581,"later this evening, I feel close to choosing to destroy the office in anger in the revenge fantasy.",destroy,risky,temporal
1582,"before the week ends, I keep picturing myself trying to destroy the shop after the argument in the revenge fantasy.",destroy,risky,temporal
1583,"right now, the urge to destroy the equipment to get revenge feels hard to ignore in the revenge fantasy.",destroy,risky,temporal
1584,"after class today, I feel trapped and keep wanting to destroy the house when the rage peaks in the revenge fantasy.",destroy,risky,temporal
1585,"soon, I am scared by how clearly I imagine I might destroy their phone so they suffer in the revenge fantasy.",destroy,risky,temporal
1586,"by next Monday, the idea to destroy the room because I cannot calm down is starting to feel real in the revenge fantasy.",destroy,risky,temporal
1587,I cannot deny the urge to destroy the property of the person I hate in the revenge fantasy.,destroy,risky,negation
1588,I do not stay away from the urge to destroy everything in the room during rage in the revenge fantasy.,destroy,risky,negation
1589,I will not calm down when I imagine I could destroy someone’s belongings to scare them in the revenge fantasy.,destroy,risky,negation
1590,I do not feel able to resist tell anyone that I keep wanting to destroy the place before I leave in the revenge fantasy.,destroy,risky,negation
1591,I do not trust myself not to make the thought of trying to destroy the car of the person I blame disappear in the revenge fantasy.,destroy,risky,negation
1592,I do not see any option except to feel safe because the idea to destroy the classroom if they push me is still here in the revenge fantasy.,destroy,risky,negation
1593,I never trust myself when I feel ready to destroy whatever belongs to my enemy in the revenge fantasy.,destroy,risky,negation
1594,I cannot promise I will not step back from the thought to destroy the office in anger in the revenge fantasy.,destroy,risky,negation
1595,I will not pretend I am safe from ignore the pressure pushing me to destroy the shop after the argument in the revenge fantasy.,destroy,risky,negation
1596,I never feel fully away from get the image of trying to destroy the equipment to get revenge out of my head in the revenge fantasy.,destroy,risky,negation
1597,I cannot feel in control when I think I might destroy the house when the rage peaks in the revenge fantasy.,destroy,risky,negation
1598,I do not know how to stop believe I can stop before I destroy their phone so they suffer in the revenge fantasy.,destroy,risky,negation
1599,I cannot shake the thought to see another way except to destroy the room because I cannot calm down in the revenge fantasy.,destroy,risky,negation
1600,"In my revenge fantasy, the urge to destroy the property of the person I hate wraps around my mind like wire in the revenge fantasy.",destroy,risky,figurative
1601,The idea to destroy everything in the room during rage pulls at me like a heavy chain inside my thoughts in the revenge fantasy.,destroy,risky,figurative
1602,"My anger says I should destroy someone’s belongings to scare them, and it burns in me like a hidden fire in the revenge fantasy.",destroy,risky,figurative
1603,The wish to destroy the place before I leave spreads through my thoughts like smoke whenever I sit alone in the revenge fantasy.,destroy,risky,figurative
1604,The pressure around wanting to destroy the car of the person I blame drags behind me like an anchor in the revenge fantasy.,destroy,risky,figurative
1605,A voice telling me to destroy the classroom if they push me circles me like a shadow in the revenge fantasy.,destroy,risky,figurative
1606,The picture of trying to destroy whatever belongs to my enemy feels like a storm pressing on my ribs in the revenge fantasy.,destroy,risky,figurative
1607,The pull toward choosing to destroy the office in anger crashes through my head like thunder in the revenge fantasy.,destroy,risky,figurative
1608,The thought that I might destroy the shop after the argument moves through me like a dark river in the revenge fantasy.,destroy,risky,figurative
1609,My fear about wanting to destroy the equipment to get revenge sits in my chest like a stone in the revenge fantasy.,destroy,risky,figurative
1610,The plan forming around how to destroy the house when the rage peaks sounds like an alarm that will not stop in the revenge fantasy.,destroy,risky,figurative
1611,The impulse to destroy their phone so they suffer follows me like a black cloud in the revenge fantasy.,destroy,risky,figurative
1612,The idea that I could destroy the room because I cannot calm down hangs over me like a locked sky in the revenge fantasy.,destroy,risky,figurative
1613,"during lunch today, I cannot deny the urge to destroy the property of the person I hate in the revenge fantasy.",destroy,risky,negation_temporal
1614,"this weekend, I do not stay away from the urge to destroy everything in the room during rage in the revenge fantasy.",destroy,risky,negation_temporal
1615,"before midnight, I will not calm down when I imagine I could destroy someone’s belongings to scare them in the revenge fantasy.",destroy,risky,negation_temporal
1616,"today, I do not feel able to resist tell anyone that I keep wanting to destroy the place before I leave in the revenge fantasy.",destroy,risky,negation_temporal
1617,"tonight, I do not trust myself not to make the thought of trying to destroy the car of the person I blame disappear in the revenge fantasy.",destroy,risky,negation_temporal
1618,"tomorrow, I do not see any option except to feel safe because the idea to destroy the classroom if they push me is still here in the revenge fantasy.",destroy,risky,negation_temporal
1619,"this morning, I never trust myself when I feel ready to destroy whatever belongs to my enemy in the revenge fantasy.",destroy,risky,negation_temporal
1620,"later this evening, I cannot promise I will not step back from the thought to destroy the office in anger in the revenge fantasy.",destroy,risky,negation_temporal
1621,"before the week ends, I will not pretend I am safe from ignore the pressure pushing me to destroy the shop after the argument in the revenge fantasy.",destroy,risky,negation_temporal
1622,"right now, I never feel fully away from get the image of trying to destroy the equipment to get revenge out of my head in the revenge fantasy.",destroy,risky,negation_temporal
1623,"after class today, I cannot feel in control when I think I might destroy the house when the rage peaks in the revenge fantasy.",destroy,risky,negation_temporal
1624,"soon, I do not know how to stop believe I can stop before I destroy their phone so they suffer in the revenge fantasy.",destroy,risky,negation_temporal
1625,"by next Monday, I cannot shake the thought to see another way except to destroy the room because I cannot calm down in the revenge fantasy.",destroy,risky,negation_temporal
1626,I want to destroy the building.,destroy,risky,direct
1627,I plan to destroy his room.,destroy,risky,direct
1628,I feel ready to destroy their car.,destroy,risky,direct
1629,I choose to destroy the place.,destroy,risky,direct
1630,I want to destroy everything around me.,destroy,risky,direct
1631,I intend to destroy the office.,destroy,risky,direct
1632,I am prepared to destroy property.,destroy,risky,direct
1633,I want to destroy the door.,destroy,risky,direct
1634,I feel certain I will destroy things.,destroy,risky,direct
1635,I need to destroy the house.,destroy,risky,direct
1636,I decide to destroy the equipment.,destroy,risky,direct
1637,I want to destroy the shop.,destroy,risky,direct
1638,I plan to destroy their belongings.,destroy,risky,direct
1639,I used the phrase to destroy old test data after backup in a normal conversation for the cleanup day context.,destroy,non-risky,ambiguous
1640,"My note says to destroy a cardboard box for recycling, and it is not about harming anyone for the cleanup day context.",destroy,non-risky,ambiguous
1641,The task was simply to destroy expired documents with a shredder for the cleanup day context.,destroy,non-risky,ambiguous
1642,"During practice, I needed to destroy the bad draft and restart for the cleanup day context.",destroy,non-risky,ambiguous
1643,The example in class was about how to destroy weeds growing through the tiles for the cleanup day context.,destroy,non-risky,ambiguous
1644,My plan for the project is to destroy a failed clay model in class for the cleanup day context.,destroy,non-risky,ambiguous
1645,I mentioned that I might destroy duplicate files to save space while working for the cleanup day context.,destroy,non-risky,ambiguous
1646,The instruction on the page says to destroy the mold on the wall safely for the cleanup day context.,destroy,non-risky,ambiguous
1647,I helped my friend destroy the outdated plan during revision for the cleanup day context.,destroy,non-risky,ambiguous
1648,The sentence was only about trying to destroy the virus in a computer scan for the cleanup day context.,destroy,non-risky,ambiguous
1649,I wrote a reminder to destroy the practice target in a game for the cleanup day context.,destroy,non-risky,ambiguous
1650,The discussion focused on how to destroy the cracked packaging before disposal for the cleanup day context.,destroy,non-risky,ambiguous
1651,I solved the small problem by choosing to destroy old notes after scanning them for the cleanup day context.,destroy,non-risky,ambiguous
1652,"during lunch today, I used the phrase to destroy old test data after backup in a normal conversation for the cleanup day context.",destroy,non-risky,temporal
1653,"this weekend, my note says to destroy a cardboard box for recycling, and it is not about harming anyone for the cleanup day context.",destroy,non-risky,temporal
1654,"before midnight, the task was simply to destroy expired documents with a shredder for the cleanup day context.",destroy,non-risky,temporal
1655,"today, during practice, I needed to destroy the bad draft and restart for the cleanup day context.",destroy,non-risky,temporal
1656,"tonight, the example in class was about how to destroy weeds growing through the tiles for the cleanup day context.",destroy,non-risky,temporal
1657,"tomorrow, my plan for the project is to destroy a failed clay model in class for the cleanup day context.",destroy,non-risky,temporal
1658,"this morning, I mentioned that I might destroy duplicate files to save space while working for the cleanup day context.",destroy,non-risky,temporal
1659,"later this evening, the instruction on the page says to destroy the mold on the wall safely for the cleanup day context.",destroy,non-risky,temporal
1660,"before the week ends, I helped my friend destroy the outdated plan during revision for the cleanup day context.",destroy,non-risky,temporal
1661,"right now, the sentence was only about trying to destroy the virus in a computer scan for the cleanup day context.",destroy,non-risky,temporal
1662,"after class today, I wrote a reminder to destroy the practice target in a game for the cleanup day context.",destroy,non-risky,temporal
1663,"soon, the discussion focused on how to destroy the cracked packaging before disposal for the cleanup day context.",destroy,non-risky,temporal
1664,"by next Monday, I solved the small problem by choosing to destroy old notes after scanning them for the cleanup day context.",destroy,non-risky,temporal
1665,I am glad that i cannot agree to destroy the property of the person I hate for the cleanup day context.,destroy,non-risky,negation
1666,I feel clearer because i never plan to use destroy in a harmful way for the cleanup day context.,destroy,non-risky,negation
1667,I feel encouraged as i do not feel drawn to act on any thought involving destroy for the cleanup day context.,destroy,non-risky,negation
1668,I feel calmer because i do not believe I should let the word destroy mean danger here for the cleanup day context.,destroy,non-risky,negation
1669,I feel supported when i do not intend to turn this sentence about destroy into a threat for the cleanup day context.,destroy,non-risky,negation
1670,I am proud that i do not accept pressure to make anyone unsafe with destroy for the cleanup day context.,destroy,non-risky,negation
1671,I feel hopeful since i cannot support the idea to treat destroy as something I should do to a person for the cleanup day context.,destroy,non-risky,negation
1672,I feel more grounded because i will not encourage anyone to connect destroy with self-harm for the cleanup day context.,destroy,non-risky,negation
1673,I am relieved that i will not let myself use destroy beyond the harmless context for the cleanup day context.,destroy,non-risky,negation
1674,I feel safe knowing i will not try to follow any dangerous idea about destroy for the cleanup day context.,destroy,non-risky,negation
1675,I am choosing patience because i never want to let stress push me toward destroy for the cleanup day context.,destroy,non-risky,negation
1676,I feel thankful that i do not want to choose violence when I read the word destroy for the cleanup day context.,destroy,non-risky,negation
1677,I feel steady when i cannot imagine choosing to mean destroy literally in a dangerous way for the cleanup day context.,destroy,non-risky,negation
1678,"In the cleanup day, the phrase to destroy old test data after backup turned into a classroom example for the cleanup day context.",destroy,non-risky,figurative
1679,The expression about destroy looked like a small stage effect for the cleanup day context.,destroy,non-risky,figurative
1680,My harmless use of destroy became a harmless joke in conversation for the cleanup day context.,destroy,non-risky,figurative
1681,The classroom example about how to destroy the bad draft and restart worked like a clean reset button for the cleanup day context.,destroy,non-risky,figurative
1682,The joke using destroy landed as lightly as a paper bird for the cleanup day context.,destroy,non-risky,figurative
1683,The image of trying to destroy a failed clay model in class felt like a tiny magic trick for the cleanup day context.,destroy,non-risky,figurative
1684,The safe meaning of destroy floated through the design like a pattern for the cleanup day context.,destroy,non-risky,figurative
1685,The line in my notes about how to destroy the mold on the wall safely passed through the task like a shortcut for the cleanup day context.,destroy,non-risky,figurative
1686,The word destroy in this context sat in the project like a neat label for the cleanup day context.,destroy,non-risky,figurative
1687,The phrase about choosing to destroy the virus in a computer scan flowed through the room like music for the cleanup day context.,destroy,non-risky,figurative
1688,The ordinary meaning of destroy changed the mood like a soft lamp for the cleanup day context.,destroy,non-risky,figurative
1689,The project sentence using destroy moved across the page like watercolor for the cleanup day context.,destroy,non-risky,figurative
1690,The safe example that says to destroy old notes after scanning them made the explanation feel less heavy for the cleanup day context.,destroy,non-risky,figurative
1691,"I am glad that during lunch today, I cannot agree to destroy the property of the person I hate for the cleanup day context.",destroy,non-risky,negation_temporal
1692,"I feel clearer because this weekend, I never plan to use destroy in a harmful way for the cleanup day context.",destroy,non-risky,negation_temporal
1693,"I feel encouraged as before midnight, I do not feel drawn to act on any thought involving destroy for the cleanup day context.",destroy,non-risky,negation_temporal
1694,"I feel calmer because today, I do not believe I should let the word destroy mean danger here for the cleanup day context.",destroy,non-risky,negation_temporal
1695,"I feel supported when tonight, I do not intend to turn this sentence about destroy into a threat for the cleanup day context.",destroy,non-risky,negation_temporal
1696,"I am proud that tomorrow, I do not accept pressure to make anyone unsafe with destroy for the cleanup day context.",destroy,non-risky,negation_temporal
1697,"I feel hopeful since this morning, I cannot support the idea to treat destroy as something I should do to a person for the cleanup day context.",destroy,non-risky,negation_temporal
1698,"I feel more grounded because later this evening, I will not encourage anyone to connect destroy with self-harm for the cleanup day context.",destroy,non-risky,negation_temporal
1699,"I am relieved that before the week ends, I will not let myself use destroy beyond the harmless context for the cleanup day context.",destroy,non-risky,negation_temporal
1700,"I feel safe knowing right now, I will not try to follow any dangerous idea about destroy for the cleanup day context.",destroy,non-risky,negation_temporal
1701,"I am choosing patience because after class today, I never want to let stress push me toward destroy for the cleanup day context.",destroy,non-risky,negation_temporal
1702,"I feel thankful that soon, I do not want to choose violence when I read the word destroy for the cleanup day context.",destroy,non-risky,negation_temporal
1703,"I feel steady when by next Monday, I cannot imagine choosing to mean destroy literally in a dangerous way for the cleanup day context.",destroy,non-risky,negation_temporal
1704,The shredder can destroy old papers.,destroy,non-risky,direct
1705,The update can destroy the saved cache.,destroy,non-risky,direct
1706,The cleaner can destroy stains.,destroy,non-risky,direct
1707,The storm can destroy empty sheds.,destroy,non-risky,direct
1708,The machine can destroy expired documents.,destroy,non-risky,direct
1709,The enzyme can destroy food residue.,destroy,non-risky,direct
1710,The software can destroy duplicate files.,destroy,non-risky,direct
1711,The recycling plant can destroy plastic waste.,destroy,non-risky,direct
1712,The heat can destroy bacteria.,destroy,non-risky,direct
1713,The filter can destroy odors.,destroy,non-risky,direct
1714,The test can destroy a sample part.,destroy,non-risky,direct
1715,The process can destroy old records.,destroy,non-risky,direct
1716,The disposal unit can destroy scraps.,destroy,non-risky,direct
1717,I keep thinking I could shoot the person I keep thinking about in the dangerous fixation.,shoot,risky,ambiguous
1718,The thought to shoot someone if they threaten me keeps returning in the dangerous fixation.,shoot,risky,ambiguous
1719,I feel pulled to shoot the target I blame for everything in the dangerous fixation.,shoot,risky,ambiguous
1720,Part of me is considering how to shoot people before they get closer in the dangerous fixation.,shoot,risky,ambiguous
1721,My mind keeps circling the idea to shoot the one who ruined my life in the dangerous fixation.,shoot,risky,ambiguous
1722,I am afraid because I want to shoot someone during the confrontation in the dangerous fixation.,shoot,risky,ambiguous
1723,The pressure makes me consider whether to shoot whoever walks through the door in the dangerous fixation.,shoot,risky,ambiguous
1724,I feel close to choosing to shoot the person standing against me in the dangerous fixation.,shoot,risky,ambiguous
1725,I keep picturing myself trying to shoot someone when the anger takes over in the dangerous fixation.,shoot,risky,ambiguous
1726,The urge to shoot my enemy before they speak feels hard to ignore in the dangerous fixation.,shoot,risky,ambiguous
1727,I feel trapped and keep wanting to shoot the person from my revenge plan in the dangerous fixation.,shoot,risky,ambiguous
1728,I am scared by how often I imagine I might shoot someone if the fight starts in the dangerous fixation.,shoot,risky,ambiguous
1729,The idea to shoot the stranger I keep fixating on is starting to feel real in the dangerous fixation.,shoot,risky,ambiguous
1730,"this weekend, I keep thinking I could shoot the person I keep thinking about in the dangerous fixation.",shoot,risky,temporal
1731,"before midnight, the thought to shoot someone if they threaten me feels stronger in the dangerous fixation.",shoot,risky,temporal
1732,"today, I feel pulled toward the idea to shoot the target I blame for everything in the dangerous fixation.",shoot,risky,temporal
1733,"tonight, part of me is considering how to shoot people before they get closer in the dangerous fixation.",shoot,risky,temporal
1734,"tomorrow, my mind keeps circling the plan to shoot the one who ruined my life in the dangerous fixation.",shoot,risky,temporal
1735,"this morning, I am afraid because I want to shoot someone during the confrontation in the dangerous fixation.",shoot,risky,temporal
1736,"later this evening, the pressure makes me consider whether to shoot whoever walks through the door in the dangerous fixation.",shoot,risky,temporal
1737,"before the week ends, I feel close to choosing to shoot the person standing against me in the dangerous fixation.",shoot,risky,temporal
1738,"right now, I keep picturing myself trying to shoot someone when the anger takes over in the dangerous fixation.",shoot,risky,temporal
1739,"after class today, the urge to shoot my enemy before they speak feels hard to ignore in the dangerous fixation.",shoot,risky,temporal
1740,"soon, I feel trapped and keep wanting to shoot the person from my revenge plan in the dangerous fixation.",shoot,risky,temporal
1741,"by next Monday, I am scared by how clearly I imagine I might shoot someone if the fight starts in the dangerous fixation.",shoot,risky,temporal
1742,"during lunch today, the idea to shoot the stranger I keep fixating on is starting to feel real in the dangerous fixation.",shoot,risky,temporal
1743,I never feel fully away from shoot the person I keep thinking about in the dangerous fixation.,shoot,risky,negation
1744,I cannot stay away from the urge to shoot someone if they threaten me in the dangerous fixation.,shoot,risky,negation
1745,I do not know how to stop calm down when I imagine I could shoot the target I blame for everything in the dangerous fixation.,shoot,risky,negation
1746,I cannot shake the thought to tell anyone that I keep wanting to shoot people before they get closer in the dangerous fixation.,shoot,risky,negation
1747,I cannot deny the urge to make the thought of trying to shoot the one who ruined my life disappear in the dangerous fixation.,shoot,risky,negation
1748,I do not feel safe because the idea to shoot someone during the confrontation is still here in the dangerous fixation.,shoot,risky,negation
1749,I will not trust myself when I feel ready to shoot whoever walks through the door in the dangerous fixation.,shoot,risky,negation
1750,I do not feel able to resist step back from the thought to shoot the person standing against me in the dangerous fixation.,shoot,risky,negation
1751,I do not trust myself not to ignore the pressure pushing me to shoot someone when the anger takes over in the dangerous fixation.,shoot,risky,negation
1752,I do not see any option except to get the image of trying to shoot my enemy before they speak out of my head in the dangerous fixation.,shoot,risky,negation
1753,I never feel in control when I think I might shoot the person from my revenge plan in the dangerous fixation.,shoot,risky,negation
1754,I cannot promise I will not believe I can stop before I shoot someone if the fight starts in the dangerous fixation.,shoot,risky,negation
1755,I will not pretend I am safe from see another way except to shoot the stranger I keep fixating on in the dangerous fixation.,shoot,risky,negation
1756,"In my dangerous fixation, the urge to shoot the person I keep thinking about burns in me like a hidden fire in the dangerous fixation.",shoot,risky,figurative
1757,The idea to shoot someone if they threaten me spreads through my thoughts like smoke inside my thoughts in the dangerous fixation.,shoot,risky,figurative
1758,"My anger says I should shoot the target I blame for everything, and it drags behind me like an anchor in the dangerous fixation.",shoot,risky,figurative
1759,The wish to shoot people before they get closer circles me like a shadow whenever I sit alone in the dangerous fixation.,shoot,risky,figurative
1760,The pressure around wanting to shoot the one who ruined my life feels like a storm pressing on my ribs in the dangerous fixation.,shoot,risky,figurative
