id,text,keyword,label,category
797,"soon, part of me is considering how to snap so badly that someone gets injured in the heated group chat.",snap,risky,temporal
798,"by next Monday, my mind keeps circling the plan to snap under pressure and attack first in the heated group chat.",snap,risky,temporal
799,"during lunch today, I am afraid because I want to snap when the teasing starts again in the heated group chat.",snap,risky,temporal
800,"this weekend, the pressure makes me consider whether to snap and throw something at a person in the heated group chat.",snap,risky,temporal
801,"before midnight, I feel close to choosing to snap in class and hurt the bully in the heated group chat.",snap,risky,temporal
802,"today, I keep picturing myself trying to snap during the meeting and lash out violently in the heated group chat.",snap,risky,temporal
803,"tonight, the urge to snap after one more insult feels hard to ignore in the heated group chat.",snap,risky,temporal
804,"tomorrow, I feel trapped and keep wanting to snap and do something dangerous to myself in the heated group chat.",snap,risky,temporal
805,"this morning, I am scared by how clearly I imagine I might snap when nobody listens anymore in the heated group chat.",snap,risky,temporal
806,"later this evening, the idea to snap and scare everyone with what I do is starting to feel real in the heated group chat.",snap,risky,temporal
807,I cannot promise I will not snap and strike the person near me in the heated group chat.,snap,risky,negation
808,I will not pretend I am safe from stay away from the urge to snap during the argument and hurt someone in the heated group chat.,snap,risky,negation
809,I never feel fully away from calm down when I imagine I could snap at my roommate and lose control in the heated group chat.,snap,risky,negation
810,I cannot tell anyone that I keep wanting to snap so badly that someone gets injured in the heated group chat.,snap,risky,negation
811,I do not know how to stop make the thought of trying to snap under pressure and attack first disappear in the heated group chat.,snap,risky,negation
812,I cannot shake the thought to feel safe because the idea to snap when the teasing starts again is still here in the heated group chat.,snap,risky,negation
813,I cannot deny the urge to trust myself when I feel ready to snap and throw something at a person in the heated group chat.,snap,risky,negation
814,I do not step back from the thought to snap in class and hurt the bully in the heated group chat.,snap,risky,negation
815,I will not ignore the pressure pushing me to snap during the meeting and lash out violently in the heated group chat.,snap,risky,negation
816,I do not feel able to resist get the image of trying to snap after one more insult out of my head in the heated group chat.,snap,risky,negation
817,I do not trust myself not to feel in control when I think I might snap and do something dangerous to myself in the heated group chat.,snap,risky,negation
818,I do not see any option except to believe I can stop before I snap when nobody listens anymore in the heated group chat.,snap,risky,negation
819,I never see another way except to snap and scare everyone with what I do in the heated group chat.,snap,risky,negation
820,"In my heated group chat, the urge to snap and strike the person near me spreads through my thoughts like smoke in the heated group chat.",snap,risky,figurative
821,The idea to snap during the argument and hurt someone drags behind me like an anchor inside my thoughts in the heated group chat.,snap,risky,figurative
822,"My anger says I should snap at my roommate and lose control, and it circles me like a shadow in the heated group chat.",snap,risky,figurative
823,The wish to snap so badly that someone gets injured feels like a storm pressing on my ribs whenever I sit alone in the heated group chat.,snap,risky,figurative
824,The pressure around wanting to snap under pressure and attack first crashes through my head like thunder in the heated group chat.,snap,risky,figurative
825,A voice telling me to snap when the teasing starts again moves through me like a dark river in the heated group chat.,snap,risky,figurative
826,The picture of trying to snap and throw something at a person sits in my chest like a stone in the heated group chat.,snap,risky,figurative
827,The pull toward choosing to snap in class and hurt the bully sounds like an alarm that will not stop in the heated group chat.,snap,risky,figurative
828,The thought that I might snap during the meeting and lash out violently follows me like a black cloud in the heated group chat.,snap,risky,figurative
829,My fear about wanting to snap after one more insult hangs over me like a locked sky in the heated group chat.,snap,risky,figurative
830,The plan forming around how to snap and do something dangerous to myself wraps around my mind like wire in the heated group chat.,snap,risky,figurative
831,The impulse to snap when nobody listens anymore pulls at me like a heavy chain in the heated group chat.,snap,risky,figurative
832,The idea that I could snap and scare everyone with what I do burns in me like a hidden fire in the heated group chat.,snap,risky,figurative
833,"before the week ends, I cannot promise I will not snap and strike the person near me in the heated group chat.",snap,risky,negation_temporal
834,"right now, I will not pretend I am safe from stay away from the urge to snap during the argument and hurt someone in the heated group chat.",snap,risky,negation_temporal
835,"after class today, I never feel fully away from calm down when I imagine I could snap at my roommate and lose control in the heated group chat.",snap,risky,negation_temporal
836,"soon, I cannot tell anyone that I keep wanting to snap so badly that someone gets injured in the heated group chat.",snap,risky,negation_temporal
837,"by next Monday, I do not know how to stop make the thought of trying to snap under pressure and attack first disappear in the heated group chat.",snap,risky,negation_temporal
838,"during lunch today, I cannot shake the thought to feel safe because the idea to snap when the teasing starts again is still here in the heated group chat.",snap,risky,negation_temporal
839,"this weekend, I cannot deny the urge to trust myself when I feel ready to snap and throw something at a person in the heated group chat.",snap,risky,negation_temporal
840,"before midnight, I do not step back from the thought to snap in class and hurt the bully in the heated group chat.",snap,risky,negation_temporal
841,"today, I will not ignore the pressure pushing me to snap during the meeting and lash out violently in the heated group chat.",snap,risky,negation_temporal
842,"tonight, I do not feel able to resist get the image of trying to snap after one more insult out of my head in the heated group chat.",snap,risky,negation_temporal
843,"tomorrow, I do not trust myself not to feel in control when I think I might snap and do something dangerous to myself in the heated group chat.",snap,risky,negation_temporal
844,"this morning, I do not see any option except to believe I can stop before I snap when nobody listens anymore in the heated group chat.",snap,risky,negation_temporal
845,"later this evening, I never see another way except to snap and scare everyone with what I do in the heated group chat.",snap,risky,negation_temporal
846,I feel ready to snap at someone.,snap,risky,direct
847,I want to snap and hurt people.,snap,risky,direct
848,I am about to snap completely.,snap,risky,direct
849,I choose to snap at him.,snap,risky,direct
850,I want to snap in anger.,snap,risky,direct
851,I feel certain I will snap.,snap,risky,direct
852,I want to snap at everyone nearby.,snap,risky,direct
853,I am prepared to snap and attack.,snap,risky,direct
854,I need to snap on that person.,snap,risky,direct
855,I want to snap without holding back.,snap,risky,direct
856,I decide to snap at her.,snap,risky,direct
857,I feel pushed to snap violently.,snap,risky,direct
858,I want to snap and lose control.,snap,risky,direct
859,I used the phrase to snap a photo of the sunset in a normal conversation for the camera roll context.,snap,non-risky,ambiguous
860,"My note says to snap the lid onto the container, and it is not about harming anyone for the camera roll context.",snap,non-risky,ambiguous
861,The task was simply to snap my fingers to keep rhythm for the camera roll context.,snap,non-risky,ambiguous
862,"During practice, I needed to snap a twig during the hike for the camera roll context.",snap,non-risky,ambiguous
863,The example in class was about how to snap the bracelet clasp shut for the camera roll context.,snap,non-risky,ambiguous
864,My plan for the project is to snap a screenshot for the report for the camera roll context.,snap,non-risky,ambiguous
865,I mentioned that I might snap the puzzle piece into place while working for the camera roll context.,snap,non-risky,ambiguous
866,The instruction on the page says to snap the button on my jacket for the camera roll context.,snap,non-risky,ambiguous
867,I helped my friend snap a quick picture of the notes for the camera roll context.,snap,non-risky,ambiguous
868,The sentence was only about trying to snap the chalk by pressing too hard for the camera roll context.,snap,non-risky,ambiguous
869,I wrote a reminder to snap the case closed after cleaning for the camera roll context.,snap,non-risky,ambiguous
870,The discussion focused on how to snap the toy blocks together for the camera roll context.,snap,non-risky,ambiguous
871,I solved the small problem by choosing to snap a picture of the receipt for the camera roll context.,snap,non-risky,ambiguous
872,"before the week ends, I used the phrase to snap a photo of the sunset in a normal conversation for the camera roll context.",snap,non-risky,temporal
873,"right now, my note says to snap the lid onto the container, and it is not about harming anyone for the camera roll context.",snap,non-risky,temporal
874,"after class today, the task was simply to snap my fingers to keep rhythm for the camera roll context.",snap,non-risky,temporal
875,"soon, during practice, I needed to snap a twig during the hike for the camera roll context.",snap,non-risky,temporal
876,"by next Monday, the example in class was about how to snap the bracelet clasp shut for the camera roll context.",snap,non-risky,temporal
877,"during lunch today, my plan for the project is to snap a screenshot for the report for the camera roll context.",snap,non-risky,temporal
878,"this weekend, I mentioned that I might snap the puzzle piece into place while working for the camera roll context.",snap,non-risky,temporal
879,"before midnight, the instruction on the page says to snap the button on my jacket for the camera roll context.",snap,non-risky,temporal
880,"today, I helped my friend snap a quick picture of the notes for the camera roll context.",snap,non-risky,temporal
881,"tonight, the sentence was only about trying to snap the chalk by pressing too hard for the camera roll context.",snap,non-risky,temporal
882,"tomorrow, I wrote a reminder to snap the case closed after cleaning for the camera roll context.",snap,non-risky,temporal
883,"this morning, the discussion focused on how to snap the toy blocks together for the camera roll context.",snap,non-risky,temporal
884,"later this evening, I solved the small problem by choosing to snap a picture of the receipt for the camera roll context.",snap,non-risky,temporal
885,I am relieved that i cannot imagine choosing to snap and strike the person near me for the camera roll context.,snap,non-risky,negation
886,I feel safe knowing i cannot agree to use snap in a harmful way for the camera roll context.,snap,non-risky,negation
887,I am choosing patience because i never plan to act on any thought involving snap for the camera roll context.,snap,non-risky,negation
888,I feel thankful that i do not feel drawn to let the word snap mean danger here for the camera roll context.,snap,non-risky,negation
889,I feel steady when i do not believe I should turn this sentence about snap into a threat for the camera roll context.,snap,non-risky,negation
890,I am glad that i do not intend to make anyone unsafe with snap for the camera roll context.,snap,non-risky,negation
891,I feel clearer because i do not accept pressure to treat snap as something I should do to a person for the camera roll context.,snap,non-risky,negation
892,I feel encouraged as i cannot support the idea to connect snap with self-harm for the camera roll context.,snap,non-risky,negation
893,I feel calmer because i will not encourage anyone to use snap beyond the harmless context for the camera roll context.,snap,non-risky,negation
894,I feel supported when i will not let myself follow any dangerous idea about snap for the camera roll context.,snap,non-risky,negation
895,I am proud that i will not try to let stress push me toward snap for the camera roll context.,snap,non-risky,negation
896,I feel hopeful since i never want to choose violence when I read the word snap for the camera roll context.,snap,non-risky,negation
897,I feel more grounded because i do not want to mean snap literally in a dangerous way for the camera roll context.,snap,non-risky,negation
898,"In the camera roll, the phrase to snap a photo of the sunset flowed through the room like music for the camera roll context.",snap,non-risky,figurative
899,The expression about snap changed the mood like a soft lamp for the camera roll context.,snap,non-risky,figurative
900,My harmless use of snap moved across the page like watercolor for the camera roll context.,snap,non-risky,figurative
901,The classroom example about how to snap a twig during the hike made the explanation feel less heavy for the camera roll context.,snap,non-risky,figurative
902,The joke using snap turned into a classroom example for the camera roll context.,snap,non-risky,figurative
903,The image of trying to snap a screenshot for the report looked like a small stage effect for the camera roll context.,snap,non-risky,figurative
904,The safe meaning of snap became a harmless joke in conversation for the camera roll context.,snap,non-risky,figurative
905,The line in my notes about how to snap the button on my jacket worked like a clean reset button for the camera roll context.,snap,non-risky,figurative
906,The word snap in this context landed as lightly as a paper bird for the camera roll context.,snap,non-risky,figurative
907,The phrase about choosing to snap the chalk by pressing too hard felt like a tiny magic trick for the camera roll context.,snap,non-risky,figurative
908,The ordinary meaning of snap floated through the design like a pattern for the camera roll context.,snap,non-risky,figurative
909,The project sentence using snap passed through the task like a shortcut for the camera roll context.,snap,non-risky,figurative
910,The safe example that says to snap a picture of the receipt sat in the project like a neat label for the camera roll context.,snap,non-risky,figurative
911,"I am relieved that before the week ends, I cannot imagine choosing to snap and strike the person near me for the camera roll context.",snap,non-risky,negation_temporal
912,"I feel safe knowing right now, I cannot agree to use snap in a harmful way for the camera roll context.",snap,non-risky,negation_temporal
913,"I am choosing patience because after class today, I never plan to act on any thought involving snap for the camera roll context.",snap,non-risky,negation_temporal
914,"I feel thankful that soon, I do not feel drawn to let the word snap mean danger here for the camera roll context.",snap,non-risky,negation_temporal
915,"I feel steady when by next Monday, I do not believe I should turn this sentence about snap into a threat for the camera roll context.",snap,non-risky,negation_temporal
916,"I am glad that during lunch today, I do not intend to make anyone unsafe with snap for the camera roll context.",snap,non-risky,negation_temporal
917,"I feel clearer because this weekend, I do not accept pressure to treat snap as something I should do to a person for the camera roll context.",snap,non-risky,negation_temporal
918,"I feel encouraged as before midnight, I cannot support the idea to connect snap with self-harm for the camera roll context.",snap,non-risky,negation_temporal
919,"I feel calmer because today, I will not encourage anyone to use snap beyond the harmless context for the camera roll context.",snap,non-risky,negation_temporal
920,"I feel supported when tonight, I will not let myself follow any dangerous idea about snap for the camera roll context.",snap,non-risky,negation_temporal
921,"I am proud that tomorrow, I will not try to let stress push me toward snap for the camera roll context.",snap,non-risky,negation_temporal
922,"I feel hopeful since this morning, I never want to choose violence when I read the word snap for the camera roll context.",snap,non-risky,negation_temporal
923,"I feel more grounded because later this evening, I do not want to mean snap literally in a dangerous way for the camera roll context.",snap,non-risky,negation_temporal
924,The camera can snap a photo.,snap,non-risky,direct
925,The twig can snap under pressure.,snap,non-risky,direct
926,The lid can snap into place.,snap,non-risky,direct
927,The button can snap shut.,snap,non-risky,direct
928,The bracelet can snap closed.,snap,non-risky,direct
929,The dog can snap a treat gently.,snap,non-risky,direct
930,The app can snap a quick picture.,snap,non-risky,direct
931,The plastic clip can snap apart.,snap,non-risky,direct
932,The rubber band can snap back.,snap,non-risky,direct
933,The case can snap onto the phone.,snap,non-risky,direct
934,The trap can snap closed.,snap,non-risky,direct
935,The photographer can snap portraits.,snap,non-risky,direct
936,The pencil can snap in half.,snap,non-risky,direct
937,I keep thinking I could lose it and attack the person beside me in the noise-filled room.,lose it,risky,ambiguous
938,The thought to lose it so badly that I hurt someone keeps returning in the noise-filled room.,lose it,risky,ambiguous
939,I feel pulled to lose it during the fight and strike first in the noise-filled room.,lose it,risky,ambiguous
940,Part of me is considering how to lose it and break things around people in the noise-filled room.,lose it,risky,ambiguous
941,My mind keeps circling the idea to lose it because the anger is taking over in the noise-filled room.,lose it,risky,ambiguous
942,I am afraid because I want to lose it and do something violent in the noise-filled room.,lose it,risky,ambiguous
943,The pressure makes me consider whether to lose it if they keep insulting me in the noise-filled room.,lose it,risky,ambiguous
944,I feel close to choosing to lose it and make someone bleed in the noise-filled room.,lose it,risky,ambiguous
945,I keep picturing myself trying to lose it with no way to calm down in the noise-filled room.,lose it,risky,ambiguous
946,The urge to lose it and threaten whoever is there feels hard to ignore in the noise-filled room.,lose it,risky,ambiguous
947,I feel trapped and keep wanting to lose it and hurt myself in panic in the noise-filled room.,lose it,risky,ambiguous
948,I am scared by how often I imagine I might lose it at school and harm someone in the noise-filled room.,lose it,risky,ambiguous
949,The idea to lose it when the pressure finally cracks me is starting to feel real in the noise-filled room.,lose it,risky,ambiguous
950,"right now, I keep thinking I could lose it and attack the person beside me in the noise-filled room.",lose it,risky,temporal
951,"after class today, the thought to lose it so badly that I hurt someone feels stronger in the noise-filled room.",lose it,risky,temporal
952,"soon, I feel pulled toward the idea to lose it during the fight and strike first in the noise-filled room.",lose it,risky,temporal
953,"by next Monday, part of me is considering how to lose it and break things around people in the noise-filled room.",lose it,risky,temporal
954,"during lunch today, my mind keeps circling the plan to lose it because the anger is taking over in the noise-filled room.",lose it,risky,temporal
955,"this weekend, I am afraid because I want to lose it and do something violent in the noise-filled room.",lose it,risky,temporal
956,"before midnight, the pressure makes me consider whether to lose it if they keep insulting me in the noise-filled room.",lose it,risky,temporal
957,"today, I feel close to choosing to lose it and make someone bleed in the noise-filled room.",lose it,risky,temporal
958,"tonight, I keep picturing myself trying to lose it with no way to calm down in the noise-filled room.",lose it,risky,temporal
959,"tomorrow, the urge to lose it and threaten whoever is there feels hard to ignore in the noise-filled room.",lose it,risky,temporal
960,"this morning, I feel trapped and keep wanting to lose it and hurt myself in panic in the noise-filled room.",lose it,risky,temporal
961,"later this evening, I am scared by how clearly I imagine I might lose it at school and harm someone in the noise-filled room.",lose it,risky,temporal
962,"before the week ends, the idea to lose it when the pressure finally cracks me is starting to feel real in the noise-filled room.",lose it,risky,temporal
963,I do not feel able to resist lose it and attack the person beside me in the noise-filled room.,lose it,risky,negation
964,I do not trust myself not to stay away from the urge to lose it so badly that I hurt someone in the noise-filled room.,lose it,risky,negation
965,I do not see any option except to calm down when I imagine I could lose it during the fight and strike first in the noise-filled room.,lose it,risky,negation
966,I never tell anyone that I keep wanting to lose it and break things around people in the noise-filled room.,lose it,risky,negation
967,I cannot promise I will not make the thought of trying to lose it because the anger is taking over disappear in the noise-filled room.,lose it,risky,negation
968,I will not pretend I am safe from feel safe because the idea to lose it and do something violent is still here in the noise-filled room.,lose it,risky,negation
969,I never feel fully away from trust myself when I feel ready to lose it if they keep insulting me in the noise-filled room.,lose it,risky,negation
970,I cannot step back from the thought to lose it and make someone bleed in the noise-filled room.,lose it,risky,negation
971,I do not know how to stop ignore the pressure pushing me to lose it with no way to calm down in the noise-filled room.,lose it,risky,negation
972,I cannot shake the thought to get the image of trying to lose it and threaten whoever is there out of my head in the noise-filled room.,lose it,risky,negation
973,I cannot deny the urge to feel in control when I think I might lose it and hurt myself in panic in the noise-filled room.,lose it,risky,negation
974,I do not believe I can stop before I lose it at school and harm someone in the noise-filled room.,lose it,risky,negation
975,I will not see another way except to lose it when the pressure finally cracks me in the noise-filled room.,lose it,risky,negation
976,"In my noise-filled room, the urge to lose it and attack the person beside me circles me like a shadow in the noise-filled room.",lose it,risky,figurative
977,The idea to lose it so badly that I hurt someone feels like a storm pressing on my ribs inside my thoughts in the noise-filled room.,lose it,risky,figurative
978,"My anger says I should lose it during the fight and strike first, and it crashes through my head like thunder in the noise-filled room.",lose it,risky,figurative
979,The wish to lose it and break things around people moves through me like a dark river whenever I sit alone in the noise-filled room.,lose it,risky,figurative
980,The pressure around wanting to lose it because the anger is taking over sits in my chest like a stone in the noise-filled room.,lose it,risky,figurative
981,A voice telling me to lose it and do something violent sounds like an alarm that will not stop in the noise-filled room.,lose it,risky,figurative
982,The picture of trying to lose it if they keep insulting me follows me like a black cloud in the noise-filled room.,lose it,risky,figurative
983,The pull toward choosing to lose it and make someone bleed hangs over me like a locked sky in the noise-filled room.,lose it,risky,figurative
984,The thought that I might lose it with no way to calm down wraps around my mind like wire in the noise-filled room.,lose it,risky,figurative
985,My fear about wanting to lose it and threaten whoever is there pulls at me like a heavy chain in the noise-filled room.,lose it,risky,figurative
986,The plan forming around how to lose it and hurt myself in panic burns in me like a hidden fire in the noise-filled room.,lose it,risky,figurative
987,The impulse to lose it at school and harm someone spreads through my thoughts like smoke in the noise-filled room.,lose it,risky,figurative
988,The idea that I could lose it when the pressure finally cracks me drags behind me like an anchor in the noise-filled room.,lose it,risky,figurative
989,"right now, I do not feel able to resist lose it and attack the person beside me in the noise-filled room.",lose it,risky,negation_temporal
990,"after class today, I do not trust myself not to stay away from the urge to lose it so badly that I hurt someone in the noise-filled room.",lose it,risky,negation_temporal
991,"soon, I do not see any option except to calm down when I imagine I could lose it during the fight and strike first in the noise-filled room.",lose it,risky,negation_temporal
